{
  "$schema": "https://json-schema.org/draft/2020-12/schema",
  "$id": "https://pilotswarm/deploy.schema.json",
  "title": "PilotSwarm OSS per-service deploy manifest",
  "type": "object",
  "additionalProperties": false,
  "required": ["schemaVersion", "name", "kind", "bicep"],
  "properties": {
    "$schema":       { "type": "string" },
    "_comment":      { "type": "string" },
    "schemaVersion": { "type": "integer", "const": 1 },
    "name": {
      "type": "string",
      "pattern": "^[a-z][a-z0-9-]*$",
      "description": "Lowercase service name; must match the parent folder."
    },
    "kind": {
      "type": "string",
      "enum": ["infra", "app"]
    },
    "instanceRequired": {
      "type": "boolean",
      "description": "Whether direct deployment requires --instance. Instance-scoped services are excluded from the all aggregate."
    },
    "configurationModule": {
      "type": "string",
      "pattern": "^[A-Za-z0-9][A-Za-z0-9._/-]*\\.mjs$",
      "description": "Optional service-owned module exporting configureEnv(env, context). Resolved inside the service directory."
    },
    "gitops": {
      "type": "object",
      "additionalProperties": false,
      "properties": {
        "source": {
          "type": "string",
          "minLength": 1,
          "description": "GitOps source folder under deploy/gitops. Defaults to the service name; supports __ENV_KEY__ tokens."
        },
        "overlay": {
          "type": "string",
          "minLength": 1,
          "description": "Overlay directory selected for this service; supports __ENV_KEY__ tokens."
        },
        "manifestContainer": {
          "type": "string",
          "minLength": 1,
          "description": "Manifest storage container name; supports __ENV_KEY__ and __SERVICE__ tokens."
        },
        "placeholders": {
          "type": "array",
          "items": {
            "type": "object",
            "additionalProperties": false,
            "required": ["path", "envKeys"],
            "properties": {
              "path": { "type": "string", "minLength": 1 },
              "envKeys": {
                "type": "array",
                "minItems": 1,
                "uniqueItems": true,
                "items": { "type": "string", "pattern": "^[A-Z][A-Z0-9_]*$" }
              },
              "required": { "type": "boolean" }
            }
          },
          "description": "Allow-listed staged files containing __ENV_KEY__ placeholders that cannot be expressed as structured Kustomize replacements."
        },
        "optionalEnvKeys": {
          "type": "array",
          "uniqueItems": true,
          "items": { "type": "string", "pattern": "^[A-Z][A-Z0-9_]*$" },
          "description": "Overlay .env keys that may intentionally render with an empty value."
        },
        "overlayEnvMaps": {
          "type": "array",
          "uniqueItems": true,
          "items": { "type": "string", "pattern": "^[A-Z][A-Z0-9_]*$" },
          "description": "Optional semicolon-delimited NAME=value env-map keys appended to the staged overlay .env."
        }
      }
    },
    "bicep": {
      "type": "object",
      "additionalProperties": false,
      "required": ["modules"],
      "properties": {
        "modules": {
          "type": "array",
          "minItems": 1,
          "items": { "$ref": "#/$defs/bicepModule" },
          "description": "Ordered Bicep modules to deploy in single-service mode (dependencies included)."
        },
        "allModeModules": {
          "type": "array",
          "minItems": 1,
          "items": { "$ref": "#/$defs/bicepModule" },
          "description": "Modules to deploy in `all` mode (typically just this service's own module — dependencies were already handled by an earlier item)."
        }
      }
    },
    "image": {
      "type": "object",
      "additionalProperties": false,
      "required": ["repo", "dockerfile"],
      "properties": {
        "repo":       { "type": "string", "pattern": "^[a-z0-9][a-z0-9-]*$" },
        "dockerfile": { "type": "string" },
        "buildWorkspaces": {
          "type": "array",
          "items": { "type": "string" },
          "minItems": 1,
          "description": "npm workspaces (relative to repo root) to compile before docker buildx build. Each runs `npm run build -w <ws>`. Defaults to ['packages/sdk']. Worker uses just the SDK; portal uses ['packages/sdk','packages/app/web']."
        }
      }
    },
    "rollout": {
      "type": "object",
      "additionalProperties": false,
      "required": ["kind", "name", "namespace"],
      "properties": {
        "kind":              { "type": "string", "enum": ["Deployment", "DaemonSet"] },
        "name":              { "type": "string" },
        "namespace":         { "type": "string" },
        "fluxConfiguration": { "type": "string" },
        "fluxKustomization": {
          "type": "string",
          "description": "Optional exact Kubernetes Flux Kustomization resource name. Defaults to <fluxConfiguration>-<fluxConfiguration>."
        },
        "verifyImage":       { "type": "boolean" },
        "expectedImageEnv": {
          "type": "string",
          "pattern": "^[A-Z][A-Z0-9_]*$",
          "description": "Optional env key containing the exact image reference expected in the live workload."
        },
        "prerequisites": {
          "type": "array",
          "items": {
            "type": "object",
            "additionalProperties": false,
            "required": ["kind", "name", "namespace"],
            "properties": {
              "kind": { "type": "string", "minLength": 1 },
              "name": { "type": "string", "minLength": 1 },
              "namespace": { "type": "string", "minLength": 1 }
            }
          },
          "description": "Kubernetes objects that must already exist before Flux reconciliation begins."
        },
        "timeout": {
          "type": "string",
          "pattern": "^[1-9][0-9]*(s|m|h)$",
          "description": "Timeout for Flux reconciliation and Kubernetes rollout status. Defaults to 10m."
        }
      },
      "description": "Present when this service produces one Kubernetes resource that the orchestrator should wait on. __ENV_KEY__ tokens are resolved from the composed env."
    },
    "pipeline": {
      "type": "array",
      "items": { "type": "string", "enum": ["build", "push", "bicep", "seed-secrets", "render", "manifests", "rollout"] },
      "description": "Override the default pipeline for this service. Defaults to deploy-manifest.defaults.pipelineByKind[kind]."
    }
  },
  "$defs": {
    "bicepModule": {
      "type": "object",
      "additionalProperties": false,
      "required": ["name", "scope"],
      "properties": {
        "name":  { "type": "string", "pattern": "^[A-Z][A-Za-z0-9]*$" },
        "scope": { "type": "string", "enum": ["sub", "group"] },
        "path":  {
          "type": "string",
          "description": "Override path to the module's main.bicep (relative to repo root). Defaults to deploy/providers/azure/services/<Name>/bicep/main.bicep."
        }
      }
    }
  }
}
